{
  "canonical_offer_id": "canonical-offer-b9ebb1f0bc11be60",
  "captured_at": "2026-07-22T20:25:00.641368+02:00",
  "conditions": {},
  "contract_type": "temps plein - contrat non communiqué",
  "employer": "Betclic Group",
  "evidence": [
    {
      "excerpt": "Staff Data Analyst - Fraud & Payment F/M (Hybrid)",
      "field": "title",
      "locator": "JSON-LD JobPosting.title"
    },
    {
      "excerpt": "Betclic Group",
      "field": "employer",
      "locator": "JSON-LD JobPosting.hiringOrganization"
    }
  ],
  "extraction": {
    "ambiguous_fields": [
      "prerequisites"
    ],
    "extractor_version": 1,
    "method": "deterministic-json-ld",
    "review_status": "required",
    "source_archive_path": "private/offer-scan-archives/2026-07-22-202500-621780-full/betclic-group.breezy.hr/10d72a4b2231ab9ee403.html",
    "source_sha256": "7c2518020c3ec2e3287e2a3cc2d2954a0bf6a50dffd3a4ce67b53a465357efb4"
  },
  "full_time": true,
  "functional_domains": [
    "conseil et relation client",
    "gestion administrative",
    "gestion et coordination de projets"
  ],
  "id": "offer-f57a6de2f9e3ef7c",
  "industry_sector_ids": [
    "numerique-et-services"
  ],
  "last_verified_at": "2026-07-22T20:25:00.641368+02:00",
  "location_label": "Bordeaux, FR",
  "preferred_skills": [],
  "prerequisites": [],
  "published_at": "2026-07-21",
  "required_skills": [],
  "sector_labels": [
    "numerique et services"
  ],
  "source_kind": "direct_employer",
  "source_site": "betclic-group.breezy.hr",
  "source_url": "https://betclic-group.breezy.hr/p/718492c4981201-staff-data-analyst-fraud-payment-f-m-hybrid?source=GoogleJobs",
  "summary": "Poste de Staff Data Analyst - Fraud & Payment F/M (Hybrid) proposé par Betclic Group à Bordeaux, FR. Les missions et conditions détaillées figurent sur la page source vérifiée.",
  "title": "Staff Data Analyst - Fraud & Payment F/M (Hybrid)",
  "verification_status": "active"
}
