{
  "canonical_offer_id": "recrutement.bpce.fr:BPCE_ASS01960",
  "captured_at": "2026-07-22T20:25:00.641368+02:00",
  "conditions": {},
  "contract_type": "Contrat en alternance",
  "employer": "BPCE Assurances IARD",
  "evidence": [
    {
      "excerpt": "Alternance - 1 an - Chargé d'Assistance Fonctionnelle et Comptable F/H",
      "field": "title",
      "locator": "BPCE API item.title"
    },
    {
      "excerpt": "Mérignac",
      "field": "location_label",
      "locator": "BPCE API item.localisation"
    }
  ],
  "extraction": {
    "ambiguous_fields": [
      "summary",
      "prerequisites"
    ],
    "extractor_version": 1,
    "method": "deterministic-api",
    "review_status": "required",
    "source_archive_path": "private/offer-scan-archives/2026-07-22-202500-621780-full/recrutement.bpce.fr/80d9dce360bf75f791a2.bin",
    "source_sha256": "a4d0b01cd7d523997e413002e338824cb3fd349eb135be9ee388d2025ff69e0c"
  },
  "full_time": null,
  "functional_domains": [
    "conseil et relation client",
    "commerce et vente",
    "gestion administrative"
  ],
  "id": "offer-3a3f0ef4f4cf6719",
  "industry_sector_ids": [
    "banque-et-assurance"
  ],
  "last_verified_at": "2026-07-22T20:25:00.641368+02:00",
  "location_label": "Mérignac",
  "preferred_skills": [],
  "prerequisites": [],
  "published_at": "2026-03-30",
  "required_skills": [],
  "sector_labels": [
    "banque et assurance"
  ],
  "source_kind": "direct_employer",
  "source_site": "recrutement.bpce.fr",
  "source_url": "https://recrutement.bpce.fr/job/alternance-1-an-charge-dassistance-fonctionnelle-et-comptable-f-h",
  "summary": "Poste de Alternance - 1 an - Chargé d'Assistance Fonctionnelle et Comptable F/H proposé par BPCE Assurances IARD à Mérignac. Revue sémantique requise avant recommandation.",
  "title": "Alternance - 1 an - Chargé d'Assistance Fonctionnelle et Comptable F/H",
  "verification_status": "active"
}
