{
  "id": "geco-assistant-direction-79800391",
  "title": "Assistant de Direction H/F",
  "employer": "Client de Geco Recrutement",
  "source_url": "https://www.hellowork.com/fr-fr/emplois/79800391.html",
  "source_site": "hellowork.com",
  "published_at": "2026-06-04",
  "captured_at": "2026-07-22T09:45:53+02:00",
  "last_verified_at": "2026-07-19T19:00:00+02:00",
  "summary": "Soutenir la direction et l’équipe : documents, agendas, échéances, événements, suivi des dossiers et circulation de l’information, dans un rôle autonome et polyvalent.",
  "location_label": "Bordeaux",
  "contract_type": "CDI",
  "full_time": true,
  "sector_labels": [
    "services aux entreprises"
  ],
  "functional_domains": [
    "gestion administrative"
  ],
  "required_skills": [
    "organisation",
    "bureautique",
    "rédaction",
    "confidentialité",
    "gestion des priorités"
  ],
  "preferred_skills": [
    "autonomie",
    "travail en équipe"
  ],
  "conditions": {
    "work_mode": "hybrid"
  },
  "compensation": {
    "minimum": 28000,
    "maximum": 33000,
    "currency": "EUR",
    "period": "year"
  },
  "verification_status": "pending",
  "verification_note": "Page exacte non confirmée pendant le scan full du 22 juillet 2026 ; offre conservée pour traçabilité et revérification."
}
