{
  "canonical_offer_id": "canonical-offer-2d79febc2adcbde6",
  "captured_at": "2026-07-22T20:25:00.641368+02:00",
  "conditions": {},
  "contract_type": "contrat non communiqué",
  "employer": "IKEA Bordeaux",
  "evidence": [
    {
      "excerpt": "0 banen in Bordeaux",
      "field": "title",
      "locator": "HTML h1 or listing link"
    },
    {
      "excerpt": "IKEA Bordeaux",
      "field": "employer",
      "locator": "regional source audit"
    }
  ],
  "extraction": {
    "ambiguous_fields": [
      "summary",
      "prerequisites",
      "location_label"
    ],
    "extractor_version": 1,
    "method": "deterministic-html",
    "review_status": "required",
    "source_archive_path": "private/offer-scan-archives/2026-07-22-202500-621780-full/jobs.ikea.com/2d79febc2adcbde6ed1d.html",
    "source_sha256": "8efffb2ee758363bff47ef260e4b0f7de9ae3354aa2be14eb8059edba5de7982"
  },
  "full_time": null,
  "functional_domains": [
    "conseil et relation client",
    "commerce et vente",
    "gestion et coordination de projets"
  ],
  "id": "offer-f573bd08ad790758",
  "industry_sector_ids": [
    "agencement-et-amenagement-interieur",
    "commerce-et-distribution"
  ],
  "last_verified_at": "2026-07-22T20:25:00.641368+02:00",
  "location_label": "Bordeaux",
  "preferred_skills": [],
  "prerequisites": [],
  "published_at": null,
  "required_skills": [
    "vente"
  ],
  "sector_labels": [
    "agencement et amenagement interieur",
    "commerce et distribution"
  ],
  "source_kind": "direct_employer",
  "source_site": "jobs.ikea.com",
  "source_url": "https://jobs.ikea.com/nl/plaats/jobs/22908/3017382-11071620-3031582/4",
  "summary": "Poste de 0 banen in Bordeaux proposé par IKEA Bordeaux à Bordeaux. La page source a été archivée et doit faire l’objet d’une revue sémantique avant recommandation.",
  "title": "0 banen in Bordeaux",
  "verification_status": "active"
}
