{
  "canonical_offer_id": "recrute.leroymerlin.fr:827624",
  "captured_at": "2026-07-22T18:57:58.517400+02:00",
  "conditions": {},
  "contract_type": "contrat non communiqué",
  "employer": "Nanterre",
  "evidence": [
    {
      "excerpt": "CDI - Vendeur magasin - Nanterre - H/F",
      "field": "title",
      "locator": "JSON-LD JobPosting.title"
    },
    {
      "excerpt": "Nanterre",
      "field": "employer",
      "locator": "JSON-LD JobPosting.hiringOrganization"
    }
  ],
  "extraction": {
    "ambiguous_fields": [
      "prerequisites"
    ],
    "extractor_version": 1,
    "method": "deterministic-json-ld",
    "review_status": "required",
    "source_archive_path": "private/offer-scan-archives/2026-07-22-185758-489223-full/recrute.leroymerlin.fr/67fad3d85c4c9ea604ca.html",
    "source_sha256": "efe444f2d7e0db85f74d6762a3718592017695b2d558f890f69039d5d578eb44"
  },
  "full_time": null,
  "functional_domains": [
    "conseil et relation client",
    "commerce et vente",
    "gestion et coordination de projets"
  ],
  "id": "offer-a00f0fe7693b448a",
  "industry_sector_ids": [
    "agencement-et-amenagement-interieur",
    "commerce-et-distribution"
  ],
  "last_verified_at": "2026-07-22T18:57:58.517400+02:00",
  "location_label": "Nanterre (92000), FR",
  "preferred_skills": [],
  "prerequisites": [],
  "published_at": "2026-06-17",
  "required_skills": [
    "relation client",
    "vente",
    "commerce",
    "conseiller de vente"
  ],
  "sector_labels": [
    "agencement et amenagement interieur",
    "commerce et distribution"
  ],
  "source_kind": "direct_employer",
  "source_site": "recrute.leroymerlin.fr",
  "source_url": "https://recrute.leroymerlin.fr/jobs/827624",
  "summary": "Poste de CDI - Vendeur magasin - Nanterre - H/F proposé par Nanterre à Nanterre (92000), FR. Les missions et conditions détaillées figurent sur la page source vérifiée.",
  "title": "CDI - Vendeur magasin - Nanterre - H/F",
  "verification_status": "active"
}
