{
  "canonical_offer_id": "canonical-offer-2fb971263b78284d",
  "captured_at": "2026-07-22T19:56:06.775708+02:00",
  "conditions": {},
  "contract_type": "contrat non communiqué",
  "employer": "Préfecture et services de l'État en Gironde",
  "evidence": [
    {
      "excerpt": "Recrutement de policiers adjoints de la zone Sud-Ouest - 3è session 2024 Paramètres d’affichage",
      "field": "title",
      "locator": "HTML h1 or listing link"
    },
    {
      "excerpt": "Préfecture et services de l'État en Gironde",
      "field": "employer",
      "locator": "regional source audit"
    }
  ],
  "extraction": {
    "ambiguous_fields": [
      "summary",
      "prerequisites",
      "location_label"
    ],
    "extractor_version": 1,
    "method": "deterministic-html",
    "review_status": "required",
    "source_archive_path": "private/offer-scan-archives/2026-07-22-195606-747817-full/gironde.gouv.fr/46c8ea6c02644a10ca67.html",
    "source_sha256": "e656b2a318768fc5fe84e08036314f6d23c177ee06f182e4928567dc9991c153"
  },
  "full_time": null,
  "functional_domains": [
    "conseil et relation client",
    "gestion administrative"
  ],
  "id": "offer-b1d54a77dadb29c2",
  "industry_sector_ids": [
    "services-publics"
  ],
  "last_verified_at": "2026-07-22T19:56:06.775708+02:00",
  "location_label": "Bordeaux",
  "preferred_skills": [],
  "prerequisites": [],
  "published_at": null,
  "required_skills": [
    "commerce"
  ],
  "sector_labels": [
    "services publics"
  ],
  "source_kind": "direct_employer",
  "source_site": "gironde.gouv.fr",
  "source_url": "https://www.gironde.gouv.fr/Publications/Concours-administratif-Examen-professionnel-Recrutement/Recrutement-de-policiers-adjoints-3e-session-2024",
  "summary": "Poste de Recrutement de policiers adjoints de la zone Sud-Ouest - 3è session 2024 Paramètres d’affichage proposé par Préfecture et services de l'État en Gironde à Bordeaux. La page source a été archivée et doit faire l’objet d’une revue sémantique avant recommandation.",
  "title": "Recrutement de policiers adjoints de la zone Sud-Ouest - 3è session 2024 Paramètres d’affichage",
  "verification_status": "active"
}
