{
  "canonical_offer_id": "canonical-offer-98ea06a6ba6156e8",
  "captured_at": "2026-07-22T20:25:00.641368+02:00",
  "conditions": {},
  "contract_type": "alternance",
  "employer": "Centre de gestion de la Gironde",
  "evidence": [
    {
      "excerpt": "Certificat professionnel d’administration des collectivités territoriales",
      "field": "title",
      "locator": "HTML h1 or listing link"
    },
    {
      "excerpt": "Centre de gestion de la Gironde",
      "field": "employer",
      "locator": "regional source audit"
    }
  ],
  "extraction": {
    "ambiguous_fields": [
      "summary",
      "prerequisites",
      "location_label"
    ],
    "extractor_version": 1,
    "method": "deterministic-html",
    "review_status": "required",
    "source_archive_path": "private/offer-scan-archives/2026-07-22-202500-621780-full/cdg33.fr/98ea06a6ba6156e8b421.html",
    "source_sha256": "97936a88926a87fda221ee9e29382db1cce273d4adc09e33f33e657369a00e64"
  },
  "full_time": null,
  "functional_domains": [
    "gestion administrative",
    "gestion et coordination de projets"
  ],
  "id": "offer-a45e2c25c8ef7769",
  "industry_sector_ids": [
    "services-publics"
  ],
  "last_verified_at": "2026-07-22T20:25:00.641368+02:00",
  "location_label": "Bordeaux",
  "preferred_skills": [],
  "prerequisites": [],
  "published_at": null,
  "required_skills": [],
  "sector_labels": [
    "services publics"
  ],
  "source_kind": "direct_employer",
  "source_site": "cdg33.fr",
  "source_url": "https://www.cdg33.fr/emploi/formations/certificat-professionnel-dadministration-des-collectivites-territoriales/",
  "summary": "Poste de Certificat professionnel d’administration des collectivités territoriales proposé par Centre de gestion de la Gironde à Bordeaux. La page source a été archivée et doit faire l’objet d’une revue sémantique avant recommandation.",
  "title": "Certificat professionnel d’administration des collectivités territoriales",
  "verification_status": "active"
}
