{
  "id": "tommy-hilfiger-conseiller-vente-11490388",
  "title": "Conseiller de Vente H/F",
  "employer": "Tommy Hilfiger - PVH",
  "source_url": "https://fr.fashionjobs.com/emploi/Conseiller-ere-de-vente-tommy-hilfiger-bordeaux-cdi-35h%2C11490388.html",
  "source_site": "fashionjobs.com",
  "source_kind": "specialized",
  "verification_status": "active",
  "published_at": "2026-04-13",
  "captured_at": "2026-07-21T23:58:00+02:00",
  "last_verified_at": "2026-07-21T23:58:00+02:00",
  "summary": "Faire vivre une expÃ©rience personnalisÃ©e aux clients de la boutique Tommy Hilfiger de Bordeaux, dÃ©velopper les ventes, garantir la prÃ©sentation du point de vente, rÃ©ceptionner les livraisons, gÃ©rer les stocks et les encaissements et transmettre une connaissance enthousiaste de la mode et des produits.",
  "location_label": "Bordeaux",
  "contract_type": "CDI",
  "full_time": true,
  "sector_labels": [
    "mode premium",
    "commerce et distribution"
  ],
  "functional_domains": [
    "conseil et relation client",
    "commerce et vente"
  ],
  "compensation": {},
  "required_skills": [
    "vente",
    "relation client",
    "stocks",
    "encaissement",
    "merchandising"
  ],
  "preferred_skills": [
    "mode",
    "anglais"
  ],
  "conditions": {
    "work_mode": "onsite",
    "hours_per_week": 35
  },
  "prerequisites": [],
  "verification_note": "Annonce revérifiée pendant le scan full du 21 juillet 2026."
}
