{
  "canonical_offer_id": "canonical-offer-3e7e9f273d2b2382",
  "captured_at": "2026-07-22T19:06:49.303633+02:00",
  "conditions": {},
  "contract_type": "contrat non communiqué",
  "employer": "IKEA Bordeaux",
  "evidence": [
    {
      "excerpt": "0 työpaikat sijainnissa Bordeaux",
      "field": "title",
      "locator": "HTML h1 or listing link"
    },
    {
      "excerpt": "IKEA Bordeaux",
      "field": "employer",
      "locator": "regional source audit"
    }
  ],
  "extraction": {
    "ambiguous_fields": [
      "summary",
      "prerequisites",
      "location_label"
    ],
    "extractor_version": 1,
    "method": "deterministic-html",
    "review_status": "required",
    "source_archive_path": "private/offer-scan-archives/2026-07-22-190649-277547-full/jobs.ikea.com/3e7e9f273d2b23827c2e.html",
    "source_sha256": "3d05bd9a1044c6956655d1cbb917a909f45a1b0d6a4bc218fd42ef9e9d359c10"
  },
  "full_time": null,
  "functional_domains": [
    "conseil et relation client",
    "commerce et vente",
    "gestion et coordination de projets"
  ],
  "id": "offer-4f579fbd3344b0d3",
  "industry_sector_ids": [
    "agencement-et-amenagement-interieur",
    "commerce-et-distribution"
  ],
  "last_verified_at": "2026-07-22T19:06:49.303633+02:00",
  "location_label": "Bordeaux",
  "preferred_skills": [],
  "prerequisites": [],
  "published_at": null,
  "required_skills": [
    "vente"
  ],
  "sector_labels": [
    "agencement et amenagement interieur",
    "commerce et distribution"
  ],
  "source_kind": "direct_employer",
  "source_site": "jobs.ikea.com",
  "source_url": "https://jobs.ikea.com/fi/sijainti/jobs/22908/3017382-11071620-3031582/4",
  "summary": "Poste de 0 työpaikat sijainnissa Bordeaux proposé par IKEA Bordeaux à Bordeaux. La page source a été archivée et doit faire l’objet d’une revue sémantique avant recommandation.",
  "title": "0 työpaikat sijainnissa Bordeaux",
  "verification_status": "active"
}
