{
  "id": "lacoste-vendeur-4417486234", "title": "Vendeur CDI F/H", "employer": "Lacoste", "source_url": "https://fr.linkedin.com/jobs/view/vendeur-euse-cdi-f-h-at-lacoste-4417486234", "source_site": "linkedin.com", "published_at": "2026-06-28", "captured_at": "2026-07-19T19:00:00+02:00", "last_verified_at": "2026-07-19T19:00:00+02:00", "summary": "Offrir un conseil et un service premium, fidéliser les clients, contribuer aux ventes, respecter les standards de merchandising et incarner la marque dans une organisation omnicanale.", "location_label": "Bordeaux", "contract_type": "CDI", "full_time": null, "sector_labels": ["luxe", "commerce et distribution"], "functional_domains": ["relation client", "vente"], "required_skills": ["service premium", "vente", "fidélisation", "merchandising"], "preferred_skills": ["omnicanal"], "conditions": {"work_mode": "onsite"}
}
