{
  "canonical_offer_id": "canonical-offer-9d37fb9a3a89877e",
  "captured_at": "2026-07-22T19:46:34.164692+02:00",
  "conditions": {},
  "contract_type": "CDI",
  "employer": "Groupe Filhet-Allard",
  "evidence": [
    {
      "excerpt": "Chargé(e) de Comptes Opérations Internationales H/F Détail de l'offre",
      "field": "title",
      "locator": "HTML h1 or listing link"
    },
    {
      "excerpt": "Groupe Filhet-Allard",
      "field": "employer",
      "locator": "regional source audit"
    }
  ],
  "extraction": {
    "ambiguous_fields": [
      "summary",
      "prerequisites",
      "location_label"
    ],
    "extractor_version": 1,
    "method": "deterministic-html",
    "review_status": "required",
    "source_archive_path": "private/offer-scan-archives/2026-07-22-194634-136072-full/groupefilhet-allard-career.talent-soft.com/9d37fb9a3a89877e897c.html",
    "source_sha256": "6d603f11792b6cdfcd2e7bdc31513aba8d858c90e82a5d20c7f5532f0178bee3"
  },
  "full_time": null,
  "functional_domains": [
    "conseil et relation client",
    "commerce et vente",
    "gestion administrative"
  ],
  "id": "offer-4ec0692e5af06db7",
  "industry_sector_ids": [
    "banque-et-assurance"
  ],
  "last_verified_at": "2026-07-22T19:46:34.164692+02:00",
  "location_label": "Bordeaux",
  "preferred_skills": [],
  "prerequisites": [],
  "published_at": null,
  "required_skills": [
    "service client",
    "commerce"
  ],
  "sector_labels": [
    "banque et assurance"
  ],
  "source_kind": "direct_employer",
  "source_site": "groupefilhet-allard-career.talent-soft.com",
  "source_url": "https://groupefilhet-allard-career.talent-soft.com/offre-de-emploi/emploi-charge-e-de-comptes-operations-internationales-h-f_1702.aspx",
  "summary": "Poste de Chargé(e) de Comptes Opérations Internationales H/F Détail de l'offre proposé par Groupe Filhet-Allard à Bordeaux. La page source a été archivée et doit faire l’objet d’une revue sémantique avant recommandation.",
  "title": "Chargé(e) de Comptes Opérations Internationales H/F Détail de l'offre",
  "verification_status": "active"
}
