{
  "canonical_offer_id": "canonical-offer-fdc6f19963e5d73d",
  "captured_at": "2026-07-22T20:00:15.182633+02:00",
  "conditions": {},
  "contract_type": "CDI",
  "employer": "Cdiscount",
  "evidence": [
    {
      "excerpt": "CHEF DE PROJET INFLUENCE F/H",
      "field": "title",
      "locator": "HTML h1 or listing link"
    },
    {
      "excerpt": "Cdiscount",
      "field": "employer",
      "locator": "regional source audit"
    }
  ],
  "extraction": {
    "ambiguous_fields": [],
    "extractor_version": 1,
    "method": "deterministic-html",
    "review_method": "LLM semantic review of archived employer evidence",
    "review_status": "completed",
    "reviewed_at": "2026-07-22T20:20:00+02:00",
    "source_archive_path": "private/offer-scan-archives/2026-07-22-200015-155066-full/emploi.cdiscount.com/fdc6f19963e5d73d7f9a.html",
    "source_sha256": "4d217b175042a8ac37c981a098ce513467530584ec15691b503ee081a017d38f"
  },
  "full_time": null,
  "functional_domains": [
    "conseil et relation client",
    "commerce et vente",
    "gestion administrative",
    "gestion et coordination de projets"
  ],
  "id": "offer-ad768c31977fac1f",
  "industry_sector_ids": [
    "commerce-et-distribution"
  ],
  "last_verified_at": "2026-07-22T20:00:15.182633+02:00",
  "location_label": "Bordeaux",
  "preferred_skills": [],
  "prerequisites": [
    {
      "assessment_note": "Cette expérience marketing spécialisée n’est pas démontrée.",
      "description": "Au moins trois ans en influence et social partnerships",
      "evidence": {
        "excerpt": "au moins 3 ans d'expérience en influence et social partnerships",
        "locator": "HTML — Profil"
      },
      "id": "trois-ans-influence",
      "kind": "prior_role",
      "mandatory": true,
      "minimum_years": 3,
      "profile_evidence_ids": [],
      "profile_status": "not_demonstrated"
    }
  ],
  "published_at": null,
  "required_skills": [
    "marketing d'influence",
    "influenceurs",
    "social partnerships",
    "Kolsquare",
    "Reech"
  ],
  "sector_labels": [
    "commerce et distribution"
  ],
  "source_kind": "direct_employer",
  "source_site": "emploi.cdiscount.com",
  "source_url": "https://emploi.cdiscount.com/nos-offres-demploi/12306",
  "summary": "Pilotage de campagnes d’influence et de partenariats sociaux, nécessitant trois ans d’expérience spécialisée.",
  "title": "CHEF DE PROJET INFLUENCE F/H",
  "verification_status": "active"
}
