{
  "canonical_offer_id": "canonical-offer-56dfd4574307023f",
  "captured_at": "2026-07-22T19:06:49.303633+02:00",
  "conditions": {},
  "contract_type": "alternance",
  "employer": "Emploi Territorial",
  "evidence": [
    {
      "excerpt": "Agent des interventions techniques polyvalent en milieu rural (h/f)",
      "field": "title",
      "locator": "HTML h1 or listing link"
    },
    {
      "excerpt": "Emploi Territorial",
      "field": "employer",
      "locator": "regional source audit"
    }
  ],
  "extraction": {
    "ambiguous_fields": [
      "summary",
      "prerequisites",
      "location_label"
    ],
    "extractor_version": 1,
    "method": "deterministic-html",
    "review_status": "required",
    "source_archive_path": "private/offer-scan-archives/2026-07-22-190649-277547-full/emploi-territorial.fr/56dfd4574307023f2058.html",
    "source_sha256": "2b6a32e97fe35205ff4daa815677075d7db46ed5405413fc4801a5ca32c82d64"
  },
  "full_time": null,
  "functional_domains": [
    "conseil et relation client",
    "gestion administrative",
    "gestion et coordination de projets"
  ],
  "id": "offer-77f118482c328697",
  "industry_sector_ids": [
    "services-publics"
  ],
  "last_verified_at": "2026-07-22T19:06:49.303633+02:00",
  "location_label": "Lieu non communiqué",
  "preferred_skills": [],
  "prerequisites": [],
  "published_at": null,
  "required_skills": [],
  "sector_labels": [
    "services publics"
  ],
  "source_kind": "specialized",
  "source_site": "emploi-territorial.fr",
  "source_url": "https://www.emploi-territorial.fr/offre/o067260722001950-agent-interventions-techniques-polyvalent-milieu-rural",
  "summary": "Poste de Agent des interventions techniques polyvalent en milieu rural (h/f) proposé par Emploi Territorial à Lieu non communiqué. La page source a été archivée et doit faire l’objet d’une revue sémantique avant recommandation.",
  "title": "Agent des interventions techniques polyvalent en milieu rural (h/f)",
  "verification_status": "active"
}
