{
  "canonical_offer_id": "canonical-offer-e7d64390219b0740",
  "captured_at": "2026-07-22T19:46:34.164692+02:00",
  "conditions": {},
  "contract_type": "CDD",
  "employer": "Ville de Mérignac",
  "evidence": [
    {
      "excerpt": "Coordinateur des interventions générales et évènementielles F/H Détail de l'offre",
      "field": "title",
      "locator": "HTML h1 or listing link"
    },
    {
      "excerpt": "Ville de Mérignac",
      "field": "employer",
      "locator": "regional source audit"
    }
  ],
  "extraction": {
    "ambiguous_fields": [
      "summary",
      "prerequisites",
      "location_label"
    ],
    "extractor_version": 1,
    "method": "deterministic-html",
    "review_status": "required",
    "source_archive_path": "private/offer-scan-archives/2026-07-22-194634-136072-full/merignac-career.talent-soft.com/e7d64390219b074027ac.html",
    "source_sha256": "63747367437c7fbf1b304e2024608f662c230b38ec20a14dbc2efaff59b8d79b"
  },
  "full_time": null,
  "functional_domains": [
    "conseil et relation client",
    "gestion administrative",
    "gestion et coordination de projets"
  ],
  "id": "offer-a43618a279a2d7aa",
  "industry_sector_ids": [
    "services-publics"
  ],
  "last_verified_at": "2026-07-22T19:46:34.164692+02:00",
  "location_label": "Bordeaux",
  "preferred_skills": [],
  "prerequisites": [],
  "published_at": null,
  "required_skills": [
    "commerce",
    "planification"
  ],
  "sector_labels": [
    "services publics"
  ],
  "source_kind": "direct_employer",
  "source_site": "merignac-career.talent-soft.com",
  "source_url": "https://merignac-career.talent-soft.com/offre-de-emploi/emploi-coordinateur-des-interventions-generales-et-evenementielles-f-h_7193.aspx",
  "summary": "Poste de Coordinateur des interventions générales et évènementielles F/H Détail de l'offre proposé par Ville de Mérignac à Bordeaux. La page source a été archivée et doit faire l’objet d’une revue sémantique avant recommandation.",
  "title": "Coordinateur des interventions générales et évènementielles F/H Détail de l'offre",
  "verification_status": "active"
}
