{
  "canonical_offer_id": "canonical-offer-b6ed1670435079ca",
  "captured_at": "2026-07-22T19:06:49.303633+02:00",
  "conditions": {},
  "contract_type": "CDD",
  "employer": "Ville de Bordeaux et CCAS",
  "evidence": [
    {
      "excerpt": "Policier municipal brigade moto H/F Détail de l'offre",
      "field": "title",
      "locator": "HTML h1 or listing link"
    },
    {
      "excerpt": "Ville de Bordeaux et CCAS",
      "field": "employer",
      "locator": "regional source audit"
    }
  ],
  "extraction": {
    "ambiguous_fields": [
      "summary",
      "prerequisites",
      "location_label"
    ],
    "extractor_version": 1,
    "method": "deterministic-html",
    "review_status": "required",
    "source_archive_path": "private/offer-scan-archives/2026-07-22-190649-277547-full/recrutement.bordeaux.fr/b6ed1670435079ca311d.html",
    "source_sha256": "2940ce806dd17d92f24a3a4ac3fab178db04df25f9c33c54aac03ff4f7530d81"
  },
  "full_time": null,
  "functional_domains": [
    "conseil et relation client",
    "gestion administrative",
    "gestion et coordination de projets"
  ],
  "id": "offer-eb162b50d82544ea",
  "industry_sector_ids": [
    "services-publics"
  ],
  "last_verified_at": "2026-07-22T19:06:49.303633+02:00",
  "location_label": "BORDEAUX",
  "preferred_skills": [],
  "prerequisites": [],
  "published_at": null,
  "required_skills": [],
  "sector_labels": [
    "services publics"
  ],
  "source_kind": "direct_employer",
  "source_site": "recrutement.bordeaux.fr",
  "source_url": "https://www.recrutement.bordeaux.fr/offre-de-emploi/emploi-policier-municipal-brigade-moto-h-f_6675.aspx",
  "summary": "Poste de Policier municipal brigade moto H/F Détail de l'offre proposé par Ville de Bordeaux et CCAS à BORDEAUX. La page source a été archivée et doit faire l’objet d’une revue sémantique avant recommandation.",
  "title": "Policier municipal brigade moto H/F Détail de l'offre",
  "verification_status": "active"
}
