{
  "canonical_offer_id": "canonical-offer-9fe134c09d6c962a",
  "captured_at": "2026-07-22T20:25:00.641368+02:00",
  "conditions": {},
  "contract_type": "temps plein - contrat non communiqué",
  "employer": "Betclic Group",
  "evidence": [
    {
      "excerpt": "Product Director - Mobile Application F/M",
      "field": "title",
      "locator": "JSON-LD JobPosting.title"
    },
    {
      "excerpt": "Betclic Group",
      "field": "employer",
      "locator": "JSON-LD JobPosting.hiringOrganization"
    }
  ],
  "extraction": {
    "ambiguous_fields": [
      "prerequisites"
    ],
    "extractor_version": 1,
    "method": "deterministic-json-ld",
    "review_status": "required",
    "source_archive_path": "private/offer-scan-archives/2026-07-22-202500-621780-full/betclic-group.breezy.hr/74c26e8d4ddee618a567.html",
    "source_sha256": "1292a26a2246602e32eda5348de24812bebec6c6678db61ddc979b4b1910806d"
  },
  "full_time": true,
  "functional_domains": [
    "conseil et relation client",
    "gestion administrative",
    "gestion et coordination de projets"
  ],
  "id": "offer-2a9b74d44e28c568",
  "industry_sector_ids": [
    "numerique-et-services"
  ],
  "last_verified_at": "2026-07-22T20:25:00.641368+02:00",
  "location_label": "Bordeaux, FR",
  "preferred_skills": [],
  "prerequisites": [],
  "published_at": "2025-05-21",
  "required_skills": [],
  "sector_labels": [
    "numerique et services"
  ],
  "source_kind": "direct_employer",
  "source_site": "betclic-group.breezy.hr",
  "source_url": "https://betclic-group.breezy.hr/p/33570f153fce01-product-director-mobile-application-f-m?source=GoogleJobs",
  "summary": "Poste de Product Director - Mobile Application F/M proposé par Betclic Group à Bordeaux, FR. Les missions et conditions détaillées figurent sur la page source vérifiée.",
  "title": "Product Director - Mobile Application F/M",
  "verification_status": "active"
}
