{
  "canonical_offer_id": "canonical-offer-1b93f406aaa1ca7c",
  "captured_at": "2026-07-22T20:25:00.641368+02:00",
  "conditions": {},
  "contract_type": "temps plein - contrat non communiqué",
  "employer": "Betclic Group",
  "evidence": [
    {
      "excerpt": "Chief of Staff F/M",
      "field": "title",
      "locator": "JSON-LD JobPosting.title"
    },
    {
      "excerpt": "Betclic Group",
      "field": "employer",
      "locator": "JSON-LD JobPosting.hiringOrganization"
    }
  ],
  "extraction": {
    "ambiguous_fields": [
      "prerequisites"
    ],
    "extractor_version": 1,
    "method": "deterministic-json-ld",
    "review_status": "required",
    "source_archive_path": "private/offer-scan-archives/2026-07-22-202500-621780-full/betclic-group.breezy.hr/d37ddb644a8249dbab75.html",
    "source_sha256": "08553873fdf4cc53959978fbf008c522cc4d51f926f26d441ef4ab1120169b2f"
  },
  "full_time": true,
  "functional_domains": [
    "conseil et relation client",
    "gestion administrative",
    "gestion et coordination de projets"
  ],
  "id": "offer-9541e66988075127",
  "industry_sector_ids": [
    "numerique-et-services"
  ],
  "last_verified_at": "2026-07-22T20:25:00.641368+02:00",
  "location_label": "Bordeaux, FR",
  "preferred_skills": [],
  "prerequisites": [],
  "published_at": "2026-04-20",
  "required_skills": [],
  "sector_labels": [
    "numerique et services"
  ],
  "source_kind": "direct_employer",
  "source_site": "betclic-group.breezy.hr",
  "source_url": "https://betclic-group.breezy.hr/p/04fa3420748a01-chief-of-staff-f-m?source=GoogleJobs",
  "summary": "Poste de Chief of Staff F/M proposé par Betclic Group à Bordeaux, FR. Les missions et conditions détaillées figurent sur la page source vérifiée.",
  "title": "Chief of Staff F/M",
  "verification_status": "active"
}
